{
  "actions": [
    "CREATE_CASE",
    "ATTACH_ORIGINAL_EMAIL"
  ],
  "created_at": "2026-01-17T08:00:09Z",
  "decision_hash": "sha256:698e66e144e0304bfd7b295723a6f80f9f638e8286b0fd40f0ccc2d9fec2565c",
  "fail_closed": false,
  "fail_closed_reason": null,
  "message_id": "83a065a2-733b-5960-b63d-0d3360f5923e",
  "priority": 3,
  "queue_id": "QUEUE_TECH_SUPPORT",
  "rule_id": "ROUTE_TECHNICAL",
  "rule_version": "1.4.1",
  "run_id": "4259d70a-ff16-54a2-8532-18cb4c62b03f",
  "schema_id": "urn:ieim:schema:routing-decision:1.0.0",
  "schema_version": "1.0.0",
  "sla_id": "SLA_1BD"
}
