{
  "actions": [
    "CREATE_CASE",
    "ATTACH_ORIGINAL_EMAIL",
    "ATTACH_ALL_FILES"
  ],
  "created_at": "2026-01-17T08:00:05Z",
  "decision_hash": "sha256:c5f65ad79e8a661ee832c78244822a70fd23ad484a7298e65dc7b6ad29f88005",
  "fail_closed": false,
  "fail_closed_reason": null,
  "message_id": "6e8c601c-2771-56e2-be1b-361ffc64a9b9",
  "priority": 1,
  "queue_id": "QUEUE_LEGAL",
  "rule_id": "ROUTE_LEGAL",
  "rule_version": "1.4.1",
  "run_id": "a652b8df-ffd2-5bca-b295-4e2f65a07904",
  "schema_id": "urn:ieim:schema:routing-decision:1.0.0",
  "schema_version": "1.0.0",
  "sla_id": "SLA_1H"
}
