{
  "actions": [
    "CREATE_CASE",
    "ATTACH_ORIGINAL_EMAIL"
  ],
  "created_at": "2026-01-17T08:00:06Z",
  "decision_hash": "sha256:322760abd07495b4745b903b227ce03369ca141a6528780be72f1d827d01b39f",
  "fail_closed": false,
  "fail_closed_reason": null,
  "message_id": "af708e2b-42d1-5b36-81b3-70f1aa978073",
  "priority": 4,
  "queue_id": "QUEUE_BILLING",
  "rule_id": "ROUTE_BILLING",
  "rule_version": "1.4.1",
  "run_id": "8e41f141-3b87-514a-bd65-c1e361ecff14",
  "schema_id": "urn:ieim:schema:routing-decision:1.0.0",
  "schema_version": "1.0.0",
  "sla_id": "SLA_3BD"
}
