{
  "actions": [
    "CREATE_CASE",
    "ATTACH_ORIGINAL_EMAIL",
    "ATTACH_ALL_FILES"
  ],
  "created_at": "2026-01-17T08:00:11Z",
  "decision_hash": "sha256:aafd4ada6d467ca8b4b0f18f523da12c6fd2bbb83fd0e7639f47fe8d8f81744e",
  "fail_closed": false,
  "fail_closed_reason": null,
  "message_id": "553f99e5-5b0e-5313-b4e7-c2f45d5069c9",
  "priority": 3,
  "queue_id": "QUEUE_CLAIMS_PROPERTY",
  "rule_id": "ROUTE_CLAIMS_PROPERTY",
  "rule_version": "1.4.1",
  "run_id": "fe517cff-01a3-561e-9e87-a30af23eacdd",
  "schema_id": "urn:ieim:schema:routing-decision:1.0.0",
  "schema_version": "1.0.0",
  "sla_id": "SLA_1BD"
}
