{
  "actions": [
    "CREATE_CASE",
    "ATTACH_ORIGINAL_EMAIL"
  ],
  "created_at": "2026-01-17T08:00:07Z",
  "decision_hash": "sha256:b8a78e5fb1e8dc5c03f6e33c5531e2acf2abdf5196383087425e837d9f4aca11",
  "fail_closed": false,
  "fail_closed_reason": null,
  "message_id": "101f1b6d-ea7b-54b4-833d-53e11c190174",
  "priority": 3,
  "queue_id": "QUEUE_BROKER_SUPPORT",
  "rule_id": "ROUTE_BROKER_INTERMEDIARY",
  "rule_version": "1.4.1",
  "run_id": "3b9d2692-3165-53cf-aeca-fa26ab75a4d9",
  "schema_id": "urn:ieim:schema:routing-decision:1.0.0",
  "schema_version": "1.0.0",
  "sla_id": "SLA_1BD"
}
